[2025-06-19 01:47:13] Starting Chunking Step...
[2025-06-19 01:47:13] Starting chunking for ./input/20USVsGarcia.txt...
[2025-06-19 01:47:18] Loading GPT-2 tokenizer...
[2025-06-19 01:47:18] Saved chunk 01 (112 words)
[2025-06-19 01:47:18] Saved chunk 02 (188 words)
[2025-06-19 01:47:18] Saved chunk 03 (185 words)
[2025-06-19 01:47:18] Saved chunk 04 (142 words)
[2025-06-19 01:47:18] Saved chunk 05 (233 words)
[2025-06-19 01:47:18] Saved chunk 06 (171 words)
[2025-06-19 01:47:18] Saved chunk 07 (74 words)
[2025-06-19 01:47:18] Saved chunk 08 (233 words)
[2025-06-19 01:47:18] Saved chunk 09 (161 words)
[2025-06-19 01:47:19] Saved chunk 10 (210 words)
[2025-06-19 01:47:19] Saved chunk 11 (208 words)
[2025-06-19 01:47:19] Saved chunk 12 (179 words)
[2025-06-19 01:47:19] Saved chunk 13 (111 words)
[2025-06-19 01:47:19] Saved chunk 14 (134 words)
[2025-06-19 01:47:19] Saved chunk 15 (184 words)
[2025-06-19 01:47:19] Saved chunk 16 (150 words)
[2025-06-19 01:47:19] Saved chunk 17 (176 words)
[2025-06-19 01:47:19] Saved chunk 18 (206 words)
[2025-06-19 01:47:19] Saved chunk 19 (240 words)
[2025-06-19 01:47:19] Saved chunk 20 (176 words)
[2025-06-19 01:47:19] Saved chunk 21 (179 words)
[2025-06-19 01:47:19] Saved chunk 22 (183 words)
[2025-06-19 01:47:19] Saved chunk 23 (164 words)
[2025-06-19 01:47:19] Saved chunk 24 (197 words)
[2025-06-19 01:47:19] Saved chunk 25 (175 words)
[2025-06-19 01:47:19] Saved chunk 26 (241 words)
[2025-06-19 01:47:19] Saved chunk 27 (222 words)
[2025-06-19 01:47:19] Saved chunk 28 (136 words)
[2025-06-19 01:47:19] Saved chunk 29 (310 words)
[2025-06-19 01:47:19] Saved chunk 30 (152 words)
[2025-06-19 01:47:19] Saved chunk 31 (201 words)
[2025-06-19 01:47:19] Saved chunk 32 (118 words)
[2025-06-19 01:47:19] Saved chunk 33 (269 words)
[2025-06-19 01:47:19] Saved chunk 34 (124 words)
[2025-06-19 01:47:19] Saved chunk 35 (119 words)
[2025-06-19 01:47:19] Saved chunk 36 (133 words)
[2025-06-19 01:47:19] Saved chunk 37 (200 words)
[2025-06-19 01:47:19] Saved chunk 38 (214 words)
[2025-06-19 01:47:19] Saved chunk 39 (175 words)
[2025-06-19 01:47:19] Saved chunk 40 (85 words)
[2025-06-19 01:47:19] Successfully created 40 chunks in 'output/20USVsGarcia/person/chunk_outputs'.
[2025-06-19 01:47:19] Total time taken: 5.34 seconds.
[2025-06-19 01:47:19] Chunking completed in 5.43 seconds.
[2025-06-19 01:47:19] Cumulative time after Chunking: 5.44 seconds.
[2025-06-19 01:47:19] Starting NER Step...
[2025-06-19 01:47:19] Found 40 chunk files.
[2025-06-19 01:47:19] Running NER on chunk_01.txt (attempt 1)...
[2025-06-19 01:48:32] Saved: output/20USVsGarcia/person/ner_outputs/chunk_01.json
[2025-06-19 01:48:32] Running NER on chunk_02.txt (attempt 1)...
[2025-06-19 01:48:37] Saved: output/20USVsGarcia/person/ner_outputs/chunk_02.json
[2025-06-19 01:48:37] Running NER on chunk_03.txt (attempt 1)...
[2025-06-19 01:48:43] Saved: output/20USVsGarcia/person/ner_outputs/chunk_03.json
[2025-06-19 01:48:43] Running NER on chunk_04.txt (attempt 1)...
[2025-06-19 01:48:47] Saved: output/20USVsGarcia/person/ner_outputs/chunk_04.json
[2025-06-19 01:48:47] Running NER on chunk_05.txt (attempt 1)...
[2025-06-19 01:48:50] Saved: output/20USVsGarcia/person/ner_outputs/chunk_05.json
[2025-06-19 01:48:50] Running NER on chunk_06.txt (attempt 1)...
[2025-06-19 01:48:56] Saved: output/20USVsGarcia/person/ner_outputs/chunk_06.json
[2025-06-19 01:48:56] Running NER on chunk_07.txt (attempt 1)...
[2025-06-19 01:49:00] Saved: output/20USVsGarcia/person/ner_outputs/chunk_07.json
[2025-06-19 01:49:00] Running NER on chunk_08.txt (attempt 1)...
[2025-06-19 01:49:05] Saved: output/20USVsGarcia/person/ner_outputs/chunk_08.json
[2025-06-19 01:49:05] Running NER on chunk_09.txt (attempt 1)...
[2025-06-19 01:49:09] Saved: output/20USVsGarcia/person/ner_outputs/chunk_09.json
[2025-06-19 01:49:09] Running NER on chunk_10.txt (attempt 1)...
[2025-06-19 01:49:13] Saved: output/20USVsGarcia/person/ner_outputs/chunk_10.json
[2025-06-19 01:49:13] Running NER on chunk_11.txt (attempt 1)...
[2025-06-19 01:49:17] Saved: output/20USVsGarcia/person/ner_outputs/chunk_11.json
[2025-06-19 01:49:17] Running NER on chunk_12.txt (attempt 1)...
[2025-06-19 01:49:19] Saved: output/20USVsGarcia/person/ner_outputs/chunk_12.json
[2025-06-19 01:49:19] Running NER on chunk_13.txt (attempt 1)...
[2025-06-19 01:49:23] Saved: output/20USVsGarcia/person/ner_outputs/chunk_13.json
[2025-06-19 01:49:23] Running NER on chunk_14.txt (attempt 1)...
[2025-06-19 01:49:28] Saved: output/20USVsGarcia/person/ner_outputs/chunk_14.json
[2025-06-19 01:49:28] Running NER on chunk_15.txt (attempt 1)...
[2025-06-19 01:49:30] Saved: output/20USVsGarcia/person/ner_outputs/chunk_15.json
[2025-06-19 01:49:30] Running NER on chunk_16.txt (attempt 1)...
[2025-06-19 01:49:33] Saved: output/20USVsGarcia/person/ner_outputs/chunk_16.json
[2025-06-19 01:49:33] Running NER on chunk_17.txt (attempt 1)...
[2025-06-19 01:49:36] Saved: output/20USVsGarcia/person/ner_outputs/chunk_17.json
[2025-06-19 01:49:36] Running NER on chunk_18.txt (attempt 1)...
[2025-06-19 01:49:40] Saved: output/20USVsGarcia/person/ner_outputs/chunk_18.json
[2025-06-19 01:49:40] Running NER on chunk_19.txt (attempt 1)...
[2025-06-19 01:49:44] Saved: output/20USVsGarcia/person/ner_outputs/chunk_19.json
[2025-06-19 01:49:44] Running NER on chunk_20.txt (attempt 1)...
[2025-06-19 01:49:47] Saved: output/20USVsGarcia/person/ner_outputs/chunk_20.json
[2025-06-19 01:49:47] Running NER on chunk_21.txt (attempt 1)...
[2025-06-19 01:49:51] Saved: output/20USVsGarcia/person/ner_outputs/chunk_21.json
[2025-06-19 01:49:51] Running NER on chunk_22.txt (attempt 1)...
[2025-06-19 01:49:54] Saved: output/20USVsGarcia/person/ner_outputs/chunk_22.json
[2025-06-19 01:49:54] Running NER on chunk_23.txt (attempt 1)...
[2025-06-19 01:49:57] Saved: output/20USVsGarcia/person/ner_outputs/chunk_23.json
[2025-06-19 01:49:57] Running NER on chunk_24.txt (attempt 1)...
[2025-06-19 01:50:01] Saved: output/20USVsGarcia/person/ner_outputs/chunk_24.json
[2025-06-19 01:50:01] Running NER on chunk_25.txt (attempt 1)...
[2025-06-19 01:50:05] Saved: output/20USVsGarcia/person/ner_outputs/chunk_25.json
[2025-06-19 01:50:05] Running NER on chunk_26.txt (attempt 1)...
[2025-06-19 01:50:08] Saved: output/20USVsGarcia/person/ner_outputs/chunk_26.json
[2025-06-19 01:50:08] Running NER on chunk_27.txt (attempt 1)...
[2025-06-19 01:50:14] Saved: output/20USVsGarcia/person/ner_outputs/chunk_27.json
[2025-06-19 01:50:14] Running NER on chunk_28.txt (attempt 1)...
[2025-06-19 01:50:16] Saved: output/20USVsGarcia/person/ner_outputs/chunk_28.json
[2025-06-19 01:50:16] Running NER on chunk_29.txt (attempt 1)...
[2025-06-19 01:50:24] Saved: output/20USVsGarcia/person/ner_outputs/chunk_29.json
[2025-06-19 01:50:24] Running NER on chunk_30.txt (attempt 1)...
[2025-06-19 01:50:29] Saved: output/20USVsGarcia/person/ner_outputs/chunk_30.json
[2025-06-19 01:50:29] Running NER on chunk_31.txt (attempt 1)...
[2025-06-19 01:50:32] Saved: output/20USVsGarcia/person/ner_outputs/chunk_31.json
[2025-06-19 01:50:32] Running NER on chunk_32.txt (attempt 1)...
[2025-06-19 01:50:35] Saved: output/20USVsGarcia/person/ner_outputs/chunk_32.json
[2025-06-19 01:50:35] Running NER on chunk_33.txt (attempt 1)...
[2025-06-19 01:50:38] Saved: output/20USVsGarcia/person/ner_outputs/chunk_33.json
[2025-06-19 01:50:38] Running NER on chunk_34.txt (attempt 1)...
[2025-06-19 01:50:40] Saved: output/20USVsGarcia/person/ner_outputs/chunk_34.json
[2025-06-19 01:50:40] Running NER on chunk_35.txt (attempt 1)...
[2025-06-19 01:50:43] Saved: output/20USVsGarcia/person/ner_outputs/chunk_35.json
[2025-06-19 01:50:43] Running NER on chunk_36.txt (attempt 1)...
[2025-06-19 01:50:47] Saved: output/20USVsGarcia/person/ner_outputs/chunk_36.json
[2025-06-19 01:50:47] Running NER on chunk_37.txt (attempt 1)...
[2025-06-19 01:50:50] Saved: output/20USVsGarcia/person/ner_outputs/chunk_37.json
[2025-06-19 01:50:50] Running NER on chunk_38.txt (attempt 1)...
[2025-06-19 01:50:53] Saved: output/20USVsGarcia/person/ner_outputs/chunk_38.json
[2025-06-19 01:50:53] Running NER on chunk_39.txt (attempt 1)...
[2025-06-19 01:50:55] Saved: output/20USVsGarcia/person/ner_outputs/chunk_39.json
[2025-06-19 01:50:55] Running NER on chunk_40.txt (attempt 1)...
[2025-06-19 01:50:57] Saved: output/20USVsGarcia/person/ner_outputs/chunk_40.json
[2025-06-19 01:50:57] NER completed in 218.65 seconds.
[2025-06-19 01:50:57] Cumulative time after NER: 224.10 seconds.
[2025-06-19 01:50:57] Starting Coreference Resolution Step...
[2025-06-19 01:50:58] Processing chunk_01 (verification=False)...
[2025-06-19 01:51:07] Saved coref output: output/20USVsGarcia/person/coref_outputs/chunk_01.json
[2025-06-19 01:51:07] Processing chunk_02 (verification=False)...
[2025-06-19 01:51:21] Saved coref output: output/20USVsGarcia/person/coref_outputs/chunk_02.json
[2025-06-19 01:51:21] Processing chunk_03 (verification=False)...
[2025-06-19 01:51:39] Saved coref output: output/20USVsGarcia/person/coref_outputs/chunk_03.json
[2025-06-19 01:51:39] Processing chunk_04 (verification=False)...
[2025-06-19 01:51:59] Saved coref output: output/20USVsGarcia/person/coref_outputs/chunk_04.json
[2025-06-19 01:51:59] Processing chunk_05 (verification=False)...
[2025-06-19 01:52:19] Saved coref output: output/20USVsGarcia/person/coref_outputs/chunk_05.json
[2025-06-19 01:52:19] Processing chunk_06 (verification=False)...
[2025-06-19 01:52:43] Saved coref output: output/20USVsGarcia/person/coref_outputs/chunk_06.json
[2025-06-19 01:52:43] Processing chunk_07 (verification=False)...
[2025-06-19 01:53:08] Saved coref output: output/20USVsGarcia/person/coref_outputs/chunk_07.json
[2025-06-19 01:53:08] Processing chunk_08 (verification=False)...
[2025-06-19 01:53:39] Saved coref output: output/20USVsGarcia/person/coref_outputs/chunk_08.json
[2025-06-19 01:53:39] Processing chunk_09 (verification=False)...
[2025-06-19 01:53:56] Saved coref output: output/20USVsGarcia/person/coref_outputs/chunk_09.json
[2025-06-19 01:53:56] Processing chunk_10 (verification=False)...
[2025-06-19 01:54:32] Saved coref output: output/20USVsGarcia/person/coref_outputs/chunk_10.json
[2025-06-19 01:54:32] Processing chunk_11 (verification=False)...
[2025-06-19 01:54:52] Saved coref output: output/20USVsGarcia/person/coref_outputs/chunk_11.json
[2025-06-19 01:54:52] Processing chunk_12 (verification=False)...
[2025-06-19 01:55:12] Saved coref output: output/20USVsGarcia/person/coref_outputs/chunk_12.json
[2025-06-19 01:55:12] Processing chunk_13 (verification=False)...
[2025-06-19 01:55:34] Saved coref output: output/20USVsGarcia/person/coref_outputs/chunk_13.json
[2025-06-19 01:55:34] Processing chunk_14 (verification=False)...
[2025-06-19 01:55:57] Saved coref output: output/20USVsGarcia/person/coref_outputs/chunk_14.json
[2025-06-19 01:55:57] Processing chunk_15 (verification=False)...
[2025-06-19 01:56:21] Saved coref output: output/20USVsGarcia/person/coref_outputs/chunk_15.json
[2025-06-19 01:56:21] Processing chunk_16 (verification=False)...
[2025-06-19 01:56:46] Saved coref output: output/20USVsGarcia/person/coref_outputs/chunk_16.json
[2025-06-19 01:56:46] Processing chunk_17 (verification=False)...
[2025-06-19 01:57:10] Saved coref output: output/20USVsGarcia/person/coref_outputs/chunk_17.json
[2025-06-19 01:57:10] Processing chunk_18 (verification=False)...
[2025-06-19 01:57:22] Saved coref output: output/20USVsGarcia/person/coref_outputs/chunk_18.json
[2025-06-19 01:57:22] Processing chunk_19 (verification=False)...
[2025-06-19 01:57:45] Saved coref output: output/20USVsGarcia/person/coref_outputs/chunk_19.json
[2025-06-19 01:57:45] Processing chunk_20 (verification=False)...
[2025-06-19 01:57:52] Saved coref output: output/20USVsGarcia/person/coref_outputs/chunk_20.json
[2025-06-19 01:57:52] Processing chunk_21 (verification=False)...
[2025-06-19 01:58:11] Saved coref output: output/20USVsGarcia/person/coref_outputs/chunk_21.json
[2025-06-19 01:58:11] Processing chunk_22 (verification=False)...
[2025-06-19 01:59:05] Saved coref output: output/20USVsGarcia/person/coref_outputs/chunk_22.json
[2025-06-19 01:59:05] Processing chunk_23 (verification=False)...
[2025-06-19 01:59:17] Saved coref output: output/20USVsGarcia/person/coref_outputs/chunk_23.json
[2025-06-19 01:59:17] Processing chunk_24 (verification=False)...
[2025-06-19 01:59:42] Saved coref output: output/20USVsGarcia/person/coref_outputs/chunk_24.json
[2025-06-19 01:59:42] Processing chunk_25 (verification=False)...
[2025-06-19 01:59:57] Saved coref output: output/20USVsGarcia/person/coref_outputs/chunk_25.json
[2025-06-19 01:59:57] Processing chunk_26 (verification=False)...
[2025-06-19 02:00:27] Saved coref output: output/20USVsGarcia/person/coref_outputs/chunk_26.json
[2025-06-19 02:00:27] Processing chunk_27 (verification=False)...
[2025-06-19 02:00:45] Saved coref output: output/20USVsGarcia/person/coref_outputs/chunk_27.json
[2025-06-19 02:00:45] Processing chunk_28 (verification=False)...
[2025-06-19 02:00:57] Saved coref output: output/20USVsGarcia/person/coref_outputs/chunk_28.json
[2025-06-19 02:00:57] Processing chunk_29 (verification=False)...
[2025-06-19 02:01:15] Saved coref output: output/20USVsGarcia/person/coref_outputs/chunk_29.json
[2025-06-19 02:01:15] Processing chunk_30 (verification=False)...
[2025-06-19 02:01:33] Saved coref output: output/20USVsGarcia/person/coref_outputs/chunk_30.json
[2025-06-19 02:01:33] Processing chunk_31 (verification=False)...
[2025-06-19 02:01:48] Saved coref output: output/20USVsGarcia/person/coref_outputs/chunk_31.json
[2025-06-19 02:01:48] Processing chunk_32 (verification=False)...
[2025-06-19 02:01:51] Saved coref output: output/20USVsGarcia/person/coref_outputs/chunk_32.json
[2025-06-19 02:01:51] Processing chunk_33 (verification=False)...
[2025-06-19 02:02:19] Saved coref output: output/20USVsGarcia/person/coref_outputs/chunk_33.json
[2025-06-19 02:02:19] Processing chunk_34 (verification=False)...
[2025-06-19 02:02:46] Saved coref output: output/20USVsGarcia/person/coref_outputs/chunk_34.json
[2025-06-19 02:02:46] Processing chunk_35 (verification=False)...
[2025-06-19 02:03:56] Saved coref output: output/20USVsGarcia/person/coref_outputs/chunk_35.json
[2025-06-19 02:03:56] Processing chunk_36 (verification=False)...
[2025-06-19 02:04:06] Saved coref output: output/20USVsGarcia/person/coref_outputs/chunk_36.json
[2025-06-19 02:04:06] Processing chunk_37 (verification=False)...
[2025-06-19 02:04:14] Saved coref output: output/20USVsGarcia/person/coref_outputs/chunk_37.json
[2025-06-19 02:04:14] Processing chunk_38 (verification=False)...
[2025-06-19 02:04:42] Saved coref output: output/20USVsGarcia/person/coref_outputs/chunk_38.json
[2025-06-19 02:04:42] Processing chunk_39 (verification=False)...
[2025-06-19 02:05:00] Saved coref output: output/20USVsGarcia/person/coref_outputs/chunk_39.json
[2025-06-19 02:05:00] Processing chunk_40 (verification=False)...
[2025-06-19 02:06:11] Saved coref output: output/20USVsGarcia/person/coref_outputs/chunk_40.json
[2025-06-19 02:06:11] Final memory saved to: output/20USVsGarcia/person/final_memory.json
[2025-06-19 02:06:11] Starting verification pass 1...
[2025-06-19 02:06:11] Processing chunk_01 (verification=True)...
[2025-06-19 02:06:18] Saved coref output: output/20USVsGarcia/person/coref_outputs/chunk_01_verify.json
[2025-06-19 02:06:18] Processing chunk_02 (verification=True)...
[2025-06-19 02:06:31] Saved coref output: output/20USVsGarcia/person/coref_outputs/chunk_02_verify.json
[2025-06-19 02:06:31] Processing chunk_03 (verification=True)...
[2025-06-19 02:06:46] Saved coref output: output/20USVsGarcia/person/coref_outputs/chunk_03_verify.json
[2025-06-19 02:06:46] Processing chunk_04 (verification=True)...
[2025-06-19 02:06:52] Saved coref output: output/20USVsGarcia/person/coref_outputs/chunk_04_verify.json
[2025-06-19 02:06:52] Processing chunk_05 (verification=True)...
[2025-06-19 02:07:14] Saved coref output: output/20USVsGarcia/person/coref_outputs/chunk_05_verify.json
[2025-06-19 02:07:14] Processing chunk_06 (verification=True)...
[2025-06-19 02:07:27] Saved coref output: output/20USVsGarcia/person/coref_outputs/chunk_06_verify.json
[2025-06-19 02:07:27] Processing chunk_07 (verification=True)...
[2025-06-19 02:07:35] Saved coref output: output/20USVsGarcia/person/coref_outputs/chunk_07_verify.json
[2025-06-19 02:07:35] Processing chunk_08 (verification=True)...
[2025-06-19 02:07:54] Saved coref output: output/20USVsGarcia/person/coref_outputs/chunk_08_verify.json
[2025-06-19 02:07:54] Processing chunk_09 (verification=True)...
[2025-06-19 02:08:14] Saved coref output: output/20USVsGarcia/person/coref_outputs/chunk_09_verify.json
[2025-06-19 02:08:14] Processing chunk_10 (verification=True)...
[2025-06-19 02:08:26] Saved coref output: output/20USVsGarcia/person/coref_outputs/chunk_10_verify.json
[2025-06-19 02:08:26] Processing chunk_11 (verification=True)...
[2025-06-19 02:08:52] Saved coref output: output/20USVsGarcia/person/coref_outputs/chunk_11_verify.json
[2025-06-19 02:08:52] Processing chunk_12 (verification=True)...
[2025-06-19 02:09:17] Saved coref output: output/20USVsGarcia/person/coref_outputs/chunk_12_verify.json
[2025-06-19 02:09:17] Processing chunk_13 (verification=True)...
[2025-06-19 02:09:43] Saved coref output: output/20USVsGarcia/person/coref_outputs/chunk_13_verify.json
[2025-06-19 02:09:43] Processing chunk_14 (verification=True)...
[2025-06-19 02:09:51] Saved coref output: output/20USVsGarcia/person/coref_outputs/chunk_14_verify.json
[2025-06-19 02:09:51] Processing chunk_15 (verification=True)...
[2025-06-19 02:10:17] Saved coref output: output/20USVsGarcia/person/coref_outputs/chunk_15_verify.json
[2025-06-19 02:10:17] Processing chunk_16 (verification=True)...
[2025-06-19 02:10:44] Saved coref output: output/20USVsGarcia/person/coref_outputs/chunk_16_verify.json
[2025-06-19 02:10:44] Processing chunk_17 (verification=True)...
[2025-06-19 02:11:11] Saved coref output: output/20USVsGarcia/person/coref_outputs/chunk_17_verify.json
[2025-06-19 02:11:11] Processing chunk_18 (verification=True)...
[2025-06-19 02:11:19] Saved coref output: output/20USVsGarcia/person/coref_outputs/chunk_18_verify.json
[2025-06-19 02:11:19] Processing chunk_19 (verification=True)...
[2025-06-19 02:11:32] Saved coref output: output/20USVsGarcia/person/coref_outputs/chunk_19_verify.json
[2025-06-19 02:11:32] Processing chunk_20 (verification=True)...
[2025-06-19 02:11:36] Saved coref output: output/20USVsGarcia/person/coref_outputs/chunk_20_verify.json
[2025-06-19 02:11:36] Processing chunk_21 (verification=True)...
[2025-06-19 02:11:52] Saved coref output: output/20USVsGarcia/person/coref_outputs/chunk_21_verify.json
[2025-06-19 02:11:52] Processing chunk_22 (verification=True)...
[2025-06-19 02:12:04] Saved coref output: output/20USVsGarcia/person/coref_outputs/chunk_22_verify.json
[2025-06-19 02:12:04] Processing chunk_23 (verification=True)...
[2025-06-19 02:12:16] Saved coref output: output/20USVsGarcia/person/coref_outputs/chunk_23_verify.json
[2025-06-19 02:12:16] Processing chunk_24 (verification=True)...
[2025-06-19 02:12:30] Saved coref output: output/20USVsGarcia/person/coref_outputs/chunk_24_verify.json
[2025-06-19 02:12:30] Processing chunk_25 (verification=True)...
[2025-06-19 02:12:43] Saved coref output: output/20USVsGarcia/person/coref_outputs/chunk_25_verify.json
[2025-06-19 02:12:43] Processing chunk_26 (verification=True)...
[2025-06-19 02:13:12] Saved coref output: output/20USVsGarcia/person/coref_outputs/chunk_26_verify.json
[2025-06-19 02:13:12] Processing chunk_27 (verification=True)...
[2025-06-19 02:13:26] Saved coref output: output/20USVsGarcia/person/coref_outputs/chunk_27_verify.json
[2025-06-19 02:13:26] Processing chunk_28 (verification=True)...
[2025-06-19 02:13:35] Saved coref output: output/20USVsGarcia/person/coref_outputs/chunk_28_verify.json
[2025-06-19 02:13:35] Processing chunk_29 (verification=True)...
[2025-06-19 02:13:52] Saved coref output: output/20USVsGarcia/person/coref_outputs/chunk_29_verify.json
[2025-06-19 02:13:52] Processing chunk_30 (verification=True)...
[2025-06-19 02:14:08] Saved coref output: output/20USVsGarcia/person/coref_outputs/chunk_30_verify.json
[2025-06-19 02:14:08] Processing chunk_31 (verification=True)...
[2025-06-19 02:14:26] Saved coref output: output/20USVsGarcia/person/coref_outputs/chunk_31_verify.json
[2025-06-19 02:14:26] Processing chunk_32 (verification=True)...
[2025-06-19 02:15:01] Saved coref output: output/20USVsGarcia/person/coref_outputs/chunk_32_verify.json
[2025-06-19 02:15:01] Processing chunk_33 (verification=True)...
[2025-06-19 02:15:35] Saved coref output: output/20USVsGarcia/person/coref_outputs/chunk_33_verify.json
[2025-06-19 02:15:35] Processing chunk_34 (verification=True)...
[2025-06-19 02:16:52] Saved coref output: output/20USVsGarcia/person/coref_outputs/chunk_34_verify.json
[2025-06-19 02:16:52] Processing chunk_35 (verification=True)...
[2025-06-19 02:18:12] Saved coref output: output/20USVsGarcia/person/coref_outputs/chunk_35_verify.json
[2025-06-19 02:18:12] Processing chunk_36 (verification=True)...
[2025-06-19 02:18:19] Saved coref output: output/20USVsGarcia/person/coref_outputs/chunk_36_verify.json
[2025-06-19 02:18:19] Processing chunk_37 (verification=True)...
[2025-06-19 02:18:27] Saved coref output: output/20USVsGarcia/person/coref_outputs/chunk_37_verify.json
[2025-06-19 02:18:27] Processing chunk_38 (verification=True)...
[2025-06-19 02:19:03] Saved coref output: output/20USVsGarcia/person/coref_outputs/chunk_38_verify.json
[2025-06-19 02:19:03] Processing chunk_39 (verification=True)...
[2025-06-19 02:19:23] Saved coref output: output/20USVsGarcia/person/coref_outputs/chunk_39_verify.json
[2025-06-19 02:19:23] Processing chunk_40 (verification=True)...
[2025-06-19 02:20:42] Saved coref output: output/20USVsGarcia/person/coref_outputs/chunk_40_verify.json
[2025-06-19 02:20:42] Final memory saved to: output/20USVsGarcia/person/final_memory.json
[2025-06-19 02:20:42] Starting verification pass 2...
[2025-06-19 02:20:42] Processing chunk_01 (verification=True)...
[2025-06-19 02:22:02] Saved coref output: output/20USVsGarcia/person/coref_outputs/chunk_01_verify.json
[2025-06-19 02:22:02] Processing chunk_02 (verification=True)...
[2025-06-19 02:22:12] Saved coref output: output/20USVsGarcia/person/coref_outputs/chunk_02_verify.json
[2025-06-19 02:22:12] Processing chunk_03 (verification=True)...
[2025-06-19 02:22:33] Saved coref output: output/20USVsGarcia/person/coref_outputs/chunk_03_verify.json
[2025-06-19 02:22:33] Processing chunk_04 (verification=True)...
[2025-06-19 02:22:41] Saved coref output: output/20USVsGarcia/person/coref_outputs/chunk_04_verify.json
[2025-06-19 02:22:41] Processing chunk_05 (verification=True)...
[2025-06-19 02:23:12] Saved coref output: output/20USVsGarcia/person/coref_outputs/chunk_05_verify.json
[2025-06-19 02:23:12] Processing chunk_06 (verification=True)...
[2025-06-19 02:23:30] Saved coref output: output/20USVsGarcia/person/coref_outputs/chunk_06_verify.json
[2025-06-19 02:23:30] Processing chunk_07 (verification=True)...
[2025-06-19 02:23:42] Saved coref output: output/20USVsGarcia/person/coref_outputs/chunk_07_verify.json
[2025-06-19 02:23:42] Processing chunk_08 (verification=True)...
[2025-06-19 02:24:09] Saved coref output: output/20USVsGarcia/person/coref_outputs/chunk_08_verify.json
[2025-06-19 02:24:09] Processing chunk_09 (verification=True)...
[2025-06-19 02:24:35] Saved coref output: output/20USVsGarcia/person/coref_outputs/chunk_09_verify.json
[2025-06-19 02:24:35] Processing chunk_10 (verification=True)...
[2025-06-19 02:24:49] Saved coref output: output/20USVsGarcia/person/coref_outputs/chunk_10_verify.json
[2025-06-19 02:24:49] Processing chunk_11 (verification=True)...
[2025-06-19 02:25:22] Saved coref output: output/20USVsGarcia/person/coref_outputs/chunk_11_verify.json
[2025-06-19 02:25:22] Processing chunk_12 (verification=True)...
[2025-06-19 02:25:58] Saved coref output: output/20USVsGarcia/person/coref_outputs/chunk_12_verify.json
[2025-06-19 02:25:58] Processing chunk_13 (verification=True)...
[2025-06-19 02:26:34] Saved coref output: output/20USVsGarcia/person/coref_outputs/chunk_13_verify.json
[2025-06-19 02:26:34] Processing chunk_14 (verification=True)...
[2025-06-19 02:27:12] Saved coref output: output/20USVsGarcia/person/coref_outputs/chunk_14_verify.json
[2025-06-19 02:27:12] Processing chunk_15 (verification=True)...
[2025-06-19 02:27:50] Saved coref output: output/20USVsGarcia/person/coref_outputs/chunk_15_verify.json
[2025-06-19 02:27:50] Processing chunk_16 (verification=True)...
[2025-06-19 02:28:28] Saved coref output: output/20USVsGarcia/person/coref_outputs/chunk_16_verify.json
[2025-06-19 02:28:28] Processing chunk_17 (verification=True)...
[2025-06-19 02:29:07] Saved coref output: output/20USVsGarcia/person/coref_outputs/chunk_17_verify.json
[2025-06-19 02:29:07] Processing chunk_18 (verification=True)...
[2025-06-19 02:29:23] Saved coref output: output/20USVsGarcia/person/coref_outputs/chunk_18_verify.json
[2025-06-19 02:29:23] Processing chunk_19 (verification=True)...
[2025-06-19 02:29:46] Saved coref output: output/20USVsGarcia/person/coref_outputs/chunk_19_verify.json
[2025-06-19 02:29:46] Processing chunk_20 (verification=True)...
[2025-06-19 02:29:57] Saved coref output: output/20USVsGarcia/person/coref_outputs/chunk_20_verify.json
[2025-06-19 02:29:57] Processing chunk_21 (verification=True)...
[2025-06-19 02:30:25] Saved coref output: output/20USVsGarcia/person/coref_outputs/chunk_21_verify.json
[2025-06-19 02:30:25] Processing chunk_22 (verification=True)...
[2025-06-19 02:31:53] Saved coref output: output/20USVsGarcia/person/coref_outputs/chunk_22_verify.json
[2025-06-19 02:31:53] Processing chunk_23 (verification=True)...
[2025-06-19 02:32:09] Saved coref output: output/20USVsGarcia/person/coref_outputs/chunk_23_verify.json
[2025-06-19 02:32:09] Processing chunk_24 (verification=True)...
[2025-06-19 02:32:33] Saved coref output: output/20USVsGarcia/person/coref_outputs/chunk_24_verify.json
[2025-06-19 02:32:33] Processing chunk_25 (verification=True)...
[2025-06-19 02:32:57] Saved coref output: output/20USVsGarcia/person/coref_outputs/chunk_25_verify.json
[2025-06-19 02:32:57] Processing chunk_26 (verification=True)...
[2025-06-19 02:33:40] Saved coref output: output/20USVsGarcia/person/coref_outputs/chunk_26_verify.json
[2025-06-19 02:33:40] Processing chunk_27 (verification=True)...
[2025-06-19 02:34:02] Saved coref output: output/20USVsGarcia/person/coref_outputs/chunk_27_verify.json
[2025-06-19 02:34:02] Processing chunk_28 (verification=True)...
[2025-06-19 02:34:20] Saved coref output: output/20USVsGarcia/person/coref_outputs/chunk_28_verify.json
[2025-06-19 02:34:20] Processing chunk_29 (verification=True)...
[2025-06-19 02:34:45] Saved coref output: output/20USVsGarcia/person/coref_outputs/chunk_29_verify.json
[2025-06-19 02:34:45] Processing chunk_30 (verification=True)...
[2025-06-19 02:35:06] Saved coref output: output/20USVsGarcia/person/coref_outputs/chunk_30_verify.json
[2025-06-19 02:35:06] Processing chunk_31 (verification=True)...
[2025-06-19 02:35:19] Saved coref output: output/20USVsGarcia/person/coref_outputs/chunk_31_verify.json
[2025-06-19 02:35:19] Processing chunk_32 (verification=True)...
[2025-06-19 02:35:54] Saved coref output: output/20USVsGarcia/person/coref_outputs/chunk_32_verify.json
[2025-06-19 02:35:54] Processing chunk_33 (verification=True)...
[2025-06-19 02:36:29] Saved coref output: output/20USVsGarcia/person/coref_outputs/chunk_33_verify.json
[2025-06-19 02:36:29] Processing chunk_34 (verification=True)...
[2025-06-19 02:37:47] Saved coref output: output/20USVsGarcia/person/coref_outputs/chunk_34_verify.json
[2025-06-19 02:37:47] Processing chunk_35 (verification=True)...
[2025-06-19 02:39:07] Saved coref output: output/20USVsGarcia/person/coref_outputs/chunk_35_verify.json
[2025-06-19 02:39:07] Processing chunk_36 (verification=True)...
[2025-06-19 02:39:20] Saved coref output: output/20USVsGarcia/person/coref_outputs/chunk_36_verify.json
[2025-06-19 02:39:20] Processing chunk_37 (verification=True)...
[2025-06-19 02:39:33] Saved coref output: output/20USVsGarcia/person/coref_outputs/chunk_37_verify.json
[2025-06-19 02:39:33] Processing chunk_38 (verification=True)...
[2025-06-19 02:40:10] Saved coref output: output/20USVsGarcia/person/coref_outputs/chunk_38_verify.json
[2025-06-19 02:40:10] Processing chunk_39 (verification=True)...
[2025-06-19 02:40:32] Saved coref output: output/20USVsGarcia/person/coref_outputs/chunk_39_verify.json
[2025-06-19 02:40:32] Processing chunk_40 (verification=True)...
[2025-06-19 02:41:52] Saved coref output: output/20USVsGarcia/person/coref_outputs/chunk_40_verify.json
[2025-06-19 02:41:52] Final memory saved to: output/20USVsGarcia/person/final_memory.json
[2025-06-19 02:41:52] Coreference Resolution completed in 3055.10 seconds.
[2025-06-19 02:41:52] Cumulative time after Coref: 3279.20 seconds.
[2025-06-19 02:41:52] Starting Final Coref Resolution Step...
[2025-06-19 02:41:53] Starting coreference resolution loop
[2025-06-19 02:41:53] Removing 41 unresolved mappings from RESOLVED_ENTITIES: ['the district judge', 'the government', 'defense counsel', 'the jury', 'the male passengers', 'the men', 'the women', 'the female passengers', 'the district court', 'the passengers', 'Brignoni-Ponce', 'the police', 'the trial judge', 'the dissenting jurors', 'the jurors', 'dissenting jurors', 'the majority', 'Hispanic residents and citizens', 'people of Hispanic-descent appearance', 'any native-born or naturalized American', 'my brethren', 'the panel majority', 'innocent passengers', 'the court', 'the Hispanic occupants', 'any other poor and disheveled American of Hispanic descent', 'the person', 'the male', 'one', 'the vehicle passengers', 'you', 'both sides', 'any future jury', 'the Court', 'each juror', 'other jurors', 'the juror', 'the judge', 'a juror', 'his affidavit', 'any other juror']
[2025-06-19 02:41:53] 44 valid RESOLVED_ENTITIES retained for final resolution.
[2025-06-19 02:41:53] [Retry 1/3] Resolving coreference for chunk_01...
[2025-06-19 02:42:03] [Retry 2/3] Resolving coreference for chunk_01...
[2025-06-19 02:42:09] [Retry 3/3] Resolving coreference for chunk_01...
[2025-06-19 02:42:15] Saved resolved text: output/20USVsGarcia/person/resolved_outputs/chunk_01_resolved.txt
[2025-06-19 02:42:15] [Retry 1/3] Resolving coreference for chunk_02...
[2025-06-19 02:42:26] [Retry 2/3] Resolving coreference for chunk_02...
[2025-06-19 02:42:37] [Retry 3/3] Resolving coreference for chunk_02...
[2025-06-19 02:42:47] Saved resolved text: output/20USVsGarcia/person/resolved_outputs/chunk_02_resolved.txt
[2025-06-19 02:42:47] [Retry 1/3] Resolving coreference for chunk_03...
[2025-06-19 02:42:59] [Retry 2/3] Resolving coreference for chunk_03...
[2025-06-19 02:43:11] [Retry 3/3] Resolving coreference for chunk_03...
[2025-06-19 02:43:24] Saved resolved text: output/20USVsGarcia/person/resolved_outputs/chunk_03_resolved.txt
[2025-06-19 02:43:24] [Retry 1/3] Resolving coreference for chunk_04...
[2025-06-19 02:43:32] [Retry 2/3] Resolving coreference for chunk_04...
[2025-06-19 02:43:40] [Retry 3/3] Resolving coreference for chunk_04...
[2025-06-19 02:43:47] Saved resolved text: output/20USVsGarcia/person/resolved_outputs/chunk_04_resolved.txt
[2025-06-19 02:43:47] [Retry 1/3] Resolving coreference for chunk_05...
[2025-06-19 02:44:00] [Retry 2/3] Resolving coreference for chunk_05...
[2025-06-19 02:44:13] [Retry 3/3] Resolving coreference for chunk_05...
[2025-06-19 02:44:26] Saved resolved text: output/20USVsGarcia/person/resolved_outputs/chunk_05_resolved.txt
[2025-06-19 02:44:26] [Retry 1/3] Resolving coreference for chunk_06...
[2025-06-19 02:44:36] [Retry 2/3] Resolving coreference for chunk_06...
[2025-06-19 02:44:46] [Retry 3/3] Resolving coreference for chunk_06...
[2025-06-19 02:44:56] Saved resolved text: output/20USVsGarcia/person/resolved_outputs/chunk_06_resolved.txt
[2025-06-19 02:44:56] [Retry 1/3] Resolving coreference for chunk_07...
[2025-06-19 02:45:01] [Retry 2/3] Resolving coreference for chunk_07...
[2025-06-19 02:45:05] [Retry 3/3] Resolving coreference for chunk_07...
[2025-06-19 02:45:10] Saved resolved text: output/20USVsGarcia/person/resolved_outputs/chunk_07_resolved.txt
[2025-06-19 02:45:10] [Retry 1/3] Resolving coreference for chunk_08...
[2025-06-19 02:45:24] [Retry 2/3] Resolving coreference for chunk_08...
[2025-06-19 02:45:37] [Retry 3/3] Resolving coreference for chunk_08...
[2025-06-19 02:45:51] Saved resolved text: output/20USVsGarcia/person/resolved_outputs/chunk_08_resolved.txt
[2025-06-19 02:45:51] [Retry 1/3] Resolving coreference for chunk_09...
[2025-06-19 02:46:00] [Retry 2/3] Resolving coreference for chunk_09...
[2025-06-19 02:46:09] [Retry 3/3] Resolving coreference for chunk_09...
[2025-06-19 02:46:18] Saved resolved text: output/20USVsGarcia/person/resolved_outputs/chunk_09_resolved.txt
[2025-06-19 02:46:18] [Retry 1/3] Resolving coreference for chunk_10...
[2025-06-19 02:46:31] [Retry 2/3] Resolving coreference for chunk_10...
[2025-06-19 02:46:43] [Retry 3/3] Resolving coreference for chunk_10...
[2025-06-19 02:46:55] Saved resolved text: output/20USVsGarcia/person/resolved_outputs/chunk_10_resolved.txt
[2025-06-19 02:46:55] [Retry 1/3] Resolving coreference for chunk_11...
[2025-06-19 02:47:08] [Retry 2/3] Resolving coreference for chunk_11...
[2025-06-19 02:47:21] [Retry 3/3] Resolving coreference for chunk_11...
[2025-06-19 02:47:33] Saved resolved text: output/20USVsGarcia/person/resolved_outputs/chunk_11_resolved.txt
[2025-06-19 02:47:33] [Retry 1/3] Resolving coreference for chunk_12...
[2025-06-19 02:47:44] [Retry 2/3] Resolving coreference for chunk_12...
[2025-06-19 02:47:55] [Retry 3/3] Resolving coreference for chunk_12...
[2025-06-19 02:48:06] Saved resolved text: output/20USVsGarcia/person/resolved_outputs/chunk_12_resolved.txt
[2025-06-19 02:48:06] [Retry 1/3] Resolving coreference for chunk_13...
[2025-06-19 02:48:13] [Retry 2/3] Resolving coreference for chunk_13...
[2025-06-19 02:48:19] [Retry 3/3] Resolving coreference for chunk_13...
[2025-06-19 02:48:25] Saved resolved text: output/20USVsGarcia/person/resolved_outputs/chunk_13_resolved.txt
[2025-06-19 02:48:26] [Retry 1/3] Resolving coreference for chunk_14...
[2025-06-19 02:48:34] [Retry 2/3] Resolving coreference for chunk_14...
[2025-06-19 02:48:42] [Retry 3/3] Resolving coreference for chunk_14...
[2025-06-19 02:48:50] Saved resolved text: output/20USVsGarcia/person/resolved_outputs/chunk_14_resolved.txt
[2025-06-19 02:48:50] [Retry 1/3] Resolving coreference for chunk_15...
[2025-06-19 02:49:01] [Retry 2/3] Resolving coreference for chunk_15...
[2025-06-19 02:49:12] [Retry 3/3] Resolving coreference for chunk_15...
[2025-06-19 02:49:23] Saved resolved text: output/20USVsGarcia/person/resolved_outputs/chunk_15_resolved.txt
[2025-06-19 02:49:23] [Retry 1/3] Resolving coreference for chunk_16...
[2025-06-19 02:49:32] [Retry 2/3] Resolving coreference for chunk_16...
[2025-06-19 02:49:41] [Retry 3/3] Resolving coreference for chunk_16...
[2025-06-19 02:49:50] Saved resolved text: output/20USVsGarcia/person/resolved_outputs/chunk_16_resolved.txt
[2025-06-19 02:49:50] [Retry 1/3] Resolving coreference for chunk_17...
[2025-06-19 02:50:00] [Retry 2/3] Resolving coreference for chunk_17...
[2025-06-19 02:50:09] [Retry 3/3] Resolving coreference for chunk_17...
[2025-06-19 02:50:19] Saved resolved text: output/20USVsGarcia/person/resolved_outputs/chunk_17_resolved.txt
[2025-06-19 02:50:19] [Retry 1/3] Resolving coreference for chunk_18...
[2025-06-19 02:50:31] [Retry 2/3] Resolving coreference for chunk_18...
[2025-06-19 02:50:42] [Retry 3/3] Resolving coreference for chunk_18...
[2025-06-19 02:50:54] Saved resolved text: output/20USVsGarcia/person/resolved_outputs/chunk_18_resolved.txt
[2025-06-19 02:50:54] [Retry 1/3] Resolving coreference for chunk_19...
[2025-06-19 02:51:08] [Retry 2/3] Resolving coreference for chunk_19...
[2025-06-19 02:51:23] [Retry 3/3] Resolving coreference for chunk_19...
[2025-06-19 02:51:36] Saved resolved text: output/20USVsGarcia/person/resolved_outputs/chunk_19_resolved.txt
[2025-06-19 02:51:36] [Retry 1/3] Resolving coreference for chunk_20...
[2025-06-19 02:51:47] [Retry 2/3] Resolving coreference for chunk_20...
[2025-06-19 02:51:58] [Retry 3/3] Resolving coreference for chunk_20...
[2025-06-19 02:52:08] Saved resolved text: output/20USVsGarcia/person/resolved_outputs/chunk_20_resolved.txt
[2025-06-19 02:52:08] [Retry 1/3] Resolving coreference for chunk_21...
[2025-06-19 02:52:19] [Retry 2/3] Resolving coreference for chunk_21...
[2025-06-19 02:52:30] [Retry 3/3] Resolving coreference for chunk_21...
[2025-06-19 02:52:41] Saved resolved text: output/20USVsGarcia/person/resolved_outputs/chunk_21_resolved.txt
[2025-06-19 02:52:41] [Retry 1/3] Resolving coreference for chunk_22...
[2025-06-19 02:52:54] [Retry 2/3] Resolving coreference for chunk_22...
[2025-06-19 02:53:06] [Retry 3/3] Resolving coreference for chunk_22...
[2025-06-19 02:53:18] Saved resolved text: output/20USVsGarcia/person/resolved_outputs/chunk_22_resolved.txt
[2025-06-19 02:53:18] [Retry 1/3] Resolving coreference for chunk_23...
[2025-06-19 02:53:30] [Retry 2/3] Resolving coreference for chunk_23...
[2025-06-19 02:53:41] [Retry 3/3] Resolving coreference for chunk_23...
[2025-06-19 02:53:52] Saved resolved text: output/20USVsGarcia/person/resolved_outputs/chunk_23_resolved.txt
[2025-06-19 02:53:52] [Retry 1/3] Resolving coreference for chunk_24...
[2025-06-19 02:54:04] [Retry 2/3] Resolving coreference for chunk_24...
[2025-06-19 02:54:16] [Retry 3/3] Resolving coreference for chunk_24...
[2025-06-19 02:54:28] Saved resolved text: output/20USVsGarcia/person/resolved_outputs/chunk_24_resolved.txt
[2025-06-19 02:54:28] [Retry 1/3] Resolving coreference for chunk_25...
[2025-06-19 02:54:38] [Retry 2/3] Resolving coreference for chunk_25...
[2025-06-19 02:54:48] [Retry 3/3] Resolving coreference for chunk_25...
[2025-06-19 02:54:58] Saved resolved text: output/20USVsGarcia/person/resolved_outputs/chunk_25_resolved.txt
[2025-06-19 02:54:58] [Retry 1/3] Resolving coreference for chunk_26...
[2025-06-19 02:55:12] [Retry 2/3] Resolving coreference for chunk_26...
[2025-06-19 02:55:26] [Retry 3/3] Resolving coreference for chunk_26...
[2025-06-19 02:55:40] Saved resolved text: output/20USVsGarcia/person/resolved_outputs/chunk_26_resolved.txt
[2025-06-19 02:55:40] [Retry 1/3] Resolving coreference for chunk_27...
[2025-06-19 02:55:54] [Retry 2/3] Resolving coreference for chunk_27...
[2025-06-19 02:56:07] [Retry 3/3] Resolving coreference for chunk_27...
[2025-06-19 02:56:20] Saved resolved text: output/20USVsGarcia/person/resolved_outputs/chunk_27_resolved.txt
[2025-06-19 02:56:20] [Retry 1/3] Resolving coreference for chunk_28...
[2025-06-19 02:56:28] [Retry 2/3] Resolving coreference for chunk_28...
[2025-06-19 02:56:36] [Retry 3/3] Resolving coreference for chunk_28...
[2025-06-19 02:56:43] Saved resolved text: output/20USVsGarcia/person/resolved_outputs/chunk_28_resolved.txt
[2025-06-19 02:56:43] [Retry 1/3] Resolving coreference for chunk_29...
[2025-06-19 02:57:02] [Retry 2/3] Resolving coreference for chunk_29...
[2025-06-19 02:57:21] [Retry 3/3] Resolving coreference for chunk_29...
[2025-06-19 02:57:40] Saved resolved text: output/20USVsGarcia/person/resolved_outputs/chunk_29_resolved.txt
[2025-06-19 02:57:40] [Retry 1/3] Resolving coreference for chunk_30...
[2025-06-19 02:57:49] [Retry 2/3] Resolving coreference for chunk_30...
[2025-06-19 02:57:58] [Retry 3/3] Resolving coreference for chunk_30...
[2025-06-19 02:58:07] Saved resolved text: output/20USVsGarcia/person/resolved_outputs/chunk_30_resolved.txt
[2025-06-19 02:58:07] [Retry 1/3] Resolving coreference for chunk_31...
[2025-06-19 02:58:20] [Retry 2/3] Resolving coreference for chunk_31...
[2025-06-19 02:58:32] [Retry 3/3] Resolving coreference for chunk_31...
[2025-06-19 02:58:43] Saved resolved text: output/20USVsGarcia/person/resolved_outputs/chunk_31_resolved.txt
[2025-06-19 02:58:43] [Retry 1/3] Resolving coreference for chunk_32...
[2025-06-19 02:58:49] [Retry 2/3] Resolving coreference for chunk_32...
[2025-06-19 02:58:55] [Retry 3/3] Resolving coreference for chunk_32...
[2025-06-19 02:59:01] Saved resolved text: output/20USVsGarcia/person/resolved_outputs/chunk_32_resolved.txt
[2025-06-19 02:59:01] [Retry 1/3] Resolving coreference for chunk_33...
[2025-06-19 02:59:16] [Retry 2/3] Resolving coreference for chunk_33...
[2025-06-19 02:59:31] [Retry 3/3] Resolving coreference for chunk_33...
[2025-06-19 02:59:45] Saved resolved text: output/20USVsGarcia/person/resolved_outputs/chunk_33_resolved.txt
[2025-06-19 02:59:45] [Retry 1/3] Resolving coreference for chunk_34...
[2025-06-19 02:59:52] [Retry 2/3] Resolving coreference for chunk_34...
[2025-06-19 02:59:59] [Retry 3/3] Resolving coreference for chunk_34...
[2025-06-19 03:00:06] Saved resolved text: output/20USVsGarcia/person/resolved_outputs/chunk_34_resolved.txt
[2025-06-19 03:00:06] [Retry 1/3] Resolving coreference for chunk_35...
[2025-06-19 03:00:13] [Retry 2/3] Resolving coreference for chunk_35...
[2025-06-19 03:00:21] [Retry 3/3] Resolving coreference for chunk_35...
[2025-06-19 03:00:28] Saved resolved text: output/20USVsGarcia/person/resolved_outputs/chunk_35_resolved.txt
[2025-06-19 03:00:28] [Retry 1/3] Resolving coreference for chunk_36...
[2025-06-19 03:00:36] [Retry 2/3] Resolving coreference for chunk_36...
[2025-06-19 03:00:45] [Retry 3/3] Resolving coreference for chunk_36...
[2025-06-19 03:00:53] Saved resolved text: output/20USVsGarcia/person/resolved_outputs/chunk_36_resolved.txt
[2025-06-19 03:00:53] [Retry 1/3] Resolving coreference for chunk_37...
[2025-06-19 03:01:04] [Retry 2/3] Resolving coreference for chunk_37...
[2025-06-19 03:01:15] [Retry 3/3] Resolving coreference for chunk_37...
[2025-06-19 03:01:25] Saved resolved text: output/20USVsGarcia/person/resolved_outputs/chunk_37_resolved.txt
[2025-06-19 03:01:25] [Retry 1/3] Resolving coreference for chunk_38...
[2025-06-19 03:01:38] [Retry 2/3] Resolving coreference for chunk_38...
[2025-06-19 03:01:51] [Retry 3/3] Resolving coreference for chunk_38...
[2025-06-19 03:02:03] Saved resolved text: output/20USVsGarcia/person/resolved_outputs/chunk_38_resolved.txt
[2025-06-19 03:02:03] [Retry 1/3] Resolving coreference for chunk_39...
[2025-06-19 03:02:15] [Retry 2/3] Resolving coreference for chunk_39...
[2025-06-19 03:02:27] [Retry 3/3] Resolving coreference for chunk_39...
[2025-06-19 03:02:39] Saved resolved text: output/20USVsGarcia/person/resolved_outputs/chunk_39_resolved.txt
[2025-06-19 03:02:39] [Retry 1/3] Resolving coreference for chunk_40...
[2025-06-19 03:02:44] [Retry 2/3] Resolving coreference for chunk_40...
[2025-06-19 03:02:49] [Retry 3/3] Resolving coreference for chunk_40...
[2025-06-19 03:02:53] Saved resolved text: output/20USVsGarcia/person/resolved_outputs/chunk_40_resolved.txt
[2025-06-19 03:02:53] Merging all resolved chunks into output/20USVsGarcia/person/person_resolved_20USVsGarcia.txt
[2025-06-19 03:02:53] All resolved chunks merged and saved to output/20USVsGarcia/person/person_resolved_20USVsGarcia.txt
[2025-06-19 03:02:53] Completed coreference resolution for all chunks.
[2025-06-19 03:02:53] Final Resolution completed in 1260.91 seconds.
[2025-06-19 03:02:53] Cumulative time after Final Resolution: 4540.11 seconds.
[2025-06-19 03:02:53] Total pipeline time: 4540.11 seconds.
[2025-08-24 19:50:15] Starting Chunking Step...
[2025-08-24 19:50:15] Starting chunking for ./input/20USVsGarcia.txt...
[2025-08-24 19:50:21] Loading GPT-2 tokenizer...
[2025-08-24 19:50:22] Saved chunk 01 (112 words)
[2025-08-24 19:50:22] Saved chunk 02 (188 words)
[2025-08-24 19:50:22] Saved chunk 03 (185 words)
[2025-08-24 19:50:22] Saved chunk 04 (142 words)
[2025-08-24 19:50:22] Saved chunk 05 (233 words)
[2025-08-24 19:50:22] Saved chunk 06 (171 words)
[2025-08-24 19:50:22] Saved chunk 07 (74 words)
[2025-08-24 19:50:22] Saved chunk 08 (233 words)
[2025-08-24 19:50:22] Saved chunk 09 (161 words)
[2025-08-24 19:50:22] Saved chunk 10 (210 words)
[2025-08-24 19:50:22] Saved chunk 11 (208 words)
[2025-08-24 19:50:22] Saved chunk 12 (179 words)
[2025-08-24 19:50:22] Saved chunk 13 (111 words)
[2025-08-24 19:50:22] Saved chunk 14 (134 words)
[2025-08-24 19:50:22] Saved chunk 15 (184 words)
[2025-08-24 19:50:22] Saved chunk 16 (150 words)
[2025-08-24 19:50:22] Saved chunk 17 (176 words)
[2025-08-24 19:50:22] Saved chunk 18 (206 words)
[2025-08-24 19:50:22] Saved chunk 19 (240 words)
[2025-08-24 19:50:22] Saved chunk 20 (176 words)
[2025-08-24 19:50:22] Saved chunk 21 (179 words)
[2025-08-24 19:50:22] Saved chunk 22 (183 words)
[2025-08-24 19:50:22] Saved chunk 23 (164 words)
[2025-08-24 19:50:22] Saved chunk 24 (197 words)
[2025-08-24 19:50:22] Saved chunk 25 (175 words)
[2025-08-24 19:50:22] Saved chunk 26 (241 words)
[2025-08-24 19:50:22] Saved chunk 27 (222 words)
[2025-08-24 19:50:22] Saved chunk 28 (136 words)
[2025-08-24 19:50:22] Saved chunk 29 (310 words)
[2025-08-24 19:50:22] Saved chunk 30 (152 words)
[2025-08-24 19:50:22] Saved chunk 31 (201 words)
[2025-08-24 19:50:22] Saved chunk 32 (118 words)
[2025-08-24 19:50:22] Saved chunk 33 (269 words)
[2025-08-24 19:50:22] Saved chunk 34 (124 words)
[2025-08-24 19:50:22] Saved chunk 35 (119 words)
[2025-08-24 19:50:22] Saved chunk 36 (133 words)
[2025-08-24 19:50:22] Saved chunk 37 (200 words)
[2025-08-24 19:50:22] Saved chunk 38 (214 words)
[2025-08-24 19:50:22] Saved chunk 39 (175 words)
[2025-08-24 19:50:22] Saved chunk 40 (85 words)
[2025-08-24 19:50:22] Successfully created 40 chunks in 'output/20USVsGarcia/person/chunk_outputs'.
[2025-08-24 19:50:22] Total time taken: 6.53 seconds.
[2025-08-24 19:50:22] Chunking completed in 6.64 seconds.
[2025-08-24 19:50:22] Cumulative time after Chunking: 6.64 seconds.
[2025-08-24 19:50:22] Starting NER Step...
[2025-08-24 19:50:22] Found 40 chunk files.
[2025-08-24 19:50:22] Running NER on chunk_01.txt (attempt 1)...
[2025-08-24 19:50:22] Prompt length (chars): 3940
[2025-08-24 19:50:24] Format issue on attempt 1: Request failed: ('Connection aborted.', RemoteDisconnected('Remote end closed connection without response'))
